"DXXTKGSS","journalArticle","2019","Daelman, Nathan; Capdevila-Cortada, Marçal; López, Núria","Dynamic charge and oxidation state of Pt/CeO2 single-atom catalysts","Nature Materials","","1476-4660","10.1038/s41563-019-0444-y","https://www.nature.com/articles/s41563-019-0444-y","The catalytic activity of metals supported on oxides depends on their charge and oxidation state. Yet, the determination of the degree of charge transfer at the interface remains elusive. Here, by combining density functional theory and first-principles molecular dynamics on Pt single atoms deposited on the CeO2 (100) surface, we show that the common representation of a static metal charge is oversimplified. Instead, we identify several well-defined charge states that are dynamically interconnected and thus coexist. The origin of this new class of strong metal–support interactions is the relative position of the Ce(4f) levels with respect to those of the noble metal, allowing electron injection to (or recovery from) the support. This process is phonon-assisted, as the Ce(4f) levels adjust by surface atom displacement, and appears for other metals (Ni) and supports (TiO2). Our dynamic model explains the unique reactivity found for activated single Pt atoms on ceria able to perform CO oxidation, meeting the Department of Energy 150 °C challenge for emissions.","2019-11","2025-05-09 07:33:22","2025-05-09 07:33:22","2025-05-09 07:33:22","1215-1221","","11","18","","Nat. Mater.","","","","","","","","en","2019 The Author(s), under exclusive licence to Springer Nature Limited","","","","www.nature.com","","Publisher: Nature Publishing Group","","D:\Zotero-data\storage\C5BFCGEZ\Daelman et al. - 2019 - Dynamic charge and oxidation state of PtCeO2 single-atom catalysts.pdf","","","Heterogeneous catalysis; Atomistic models; interfaces and thin films; Surfaces","","","","","","","","","","","","","","","","","","","","","","","","","","","","","","","","","","","","","","","","","","","","","",""
"HDZUMD3Z","journalArticle","2018","Wei, Shengjie; Li, Ang; Liu, Jin-Cheng; Li, Zhi; Chen, Wenxing; Gong, Yue; Zhang, Qinghua; Cheong, Weng-Chon; Wang, Yu; Zheng, Lirong; Xiao, Hai; Chen, Chen; Wang, Dingsheng; Peng, Qing; Gu, Lin; Han, Xiaodong; Li, Jun; Li, Yadong","Direct observation of noble metal nanoparticles transforming to thermally stable single atoms","Nature Nanotechnology","","1748-3395","10.1038/s41565-018-0197-9","https://www.nature.com/articles/s41565-018-0197-9","Single noble metal atoms and ultrafine metal clusters catalysts tend to sinter into aggregated particles at elevated temperatures, driven by the decrease of metal surface free energy. Herein, we report an unexpected phenomenon that noble metal nanoparticles (Pd, Pt, Au-NPs) can be transformed to thermally stable single atoms (Pd, Pt, Au-SAs) above 900 °C in an inert atmosphere. The atomic dispersion of metal single atoms was confirmed by aberration-corrected scanning transmission electron microscopy and X-ray absorption fine structures. The dynamic process was recorded by in situ environmental transmission electron microscopy, which showed competing sintering and atomization processes during NP-to-SA conversion. Further, density functional theory calculations revealed that high-temperature NP-to-SA conversion was driven by the formation of the more thermodynamically stable Pd-N4 structure when mobile Pd atoms were captured on the defects of nitrogen-doped carbon. The thermally stable single atoms (Pd-SAs) exhibited even better activity and selectivity than nanoparticles (Pd-NPs) for semi-hydrogenation of acetylene.","2018-09","2025-05-09 07:32:41","2025-05-09 07:32:41","2025-05-09 07:32:41","856-861","","9","13","","Nature Nanotech","","","","","","","","en","2018 The Author(s)","","","","www.nature.com","","Publisher: Nature Publishing Group","","D:\Zotero-data\storage\UMXVI9HT\Wei et al. - 2018 - Direct observation of noble metal nanoparticles transforming to thermally stable single atoms.pdf","","","Materials for energy and catalysis; Chemistry; Materials science; Nanoscale materials","","","","","","","","","","","","","","","","","","","","","","","","","","","","","","","","","","","","","","","","","","","","","",""
"HA84LSPA","journalArticle","2020","Xiong, Yu; Dong, Juncai; Huang, Zheng-Qing; Xin, Pingyu; Chen, Wenxing; Wang, Yu; Li, Zhi; Jin, Zhao; Xing, Wei; Zhuang, Zhongbin; Ye, Jinyu; Wei, Xing; Cao, Rui; Gu, Lin; Sun, Shigang; Zhuang, Lin; Chen, Xiaoqing; Yang, Hua; Chen, Chen; Peng, Qing; Chang, Chun-Ran; Wang, Dingsheng; Li, Yadong","Single-atom Rh/N-doped carbon electrocatalyst for formic acid oxidation","Nature Nanotechnology","","1748-3395","10.1038/s41565-020-0665-x","https://www.nature.com/articles/s41565-020-0665-x","To meet the requirements of potential applications, it is of great importance to explore new catalysts for formic acid oxidation that have both ultra-high mass activity and CO resistance. Here, we successfully synthesize atomically dispersed Rh on N-doped carbon (SA-Rh/CN) and discover that SA-Rh/CN exhibits promising electrocatalytic properties for formic acid oxidation. The mass activity shows 28- and 67-fold enhancements compared with state-of-the-art Pd/C and Pt/C, respectively, despite the low activity of Rh/C. Interestingly, SA-Rh/CN exhibits greatly enhanced tolerance to CO poisoning, and Rh atoms in SA-Rh/CN resist sintering after long-term testing, resulting in excellent catalytic stability. Density functional theory calculations suggest that the formate route is more favourable on SA-Rh/CN. According to calculations, the high barrier to produce CO, together with the relatively unfavourable binding with CO, contribute to its CO tolerance.","2020-05","2025-05-09 07:31:36","2025-05-09 07:31:36","2025-05-09 07:31:36","390-397","","5","15","","Nat. Nanotechnol.","","","","","","","","en","2020 The Author(s), under exclusive licence to Springer Nature Limited","","","","www.nature.com","","Publisher: Nature Publishing Group","","D:\Zotero-data\storage\EURN4IN3\Xiong et al. - 2020 - Single-atom RhN-doped carbon electrocatalyst for formic acid oxidation.pdf","","","Electrocatalysis; Materials science","","","","","","","","","","","","","","","","","","","","","","","","","","","","","","","","","","","","","","","","","","","","","",""
"SS8BNFPS","journalArticle","2020","Li, Zhi; Chen, Yuanjun; Ji, Shufang; Tang, Yan; Chen, Wenxing; Li, Ang; Zhao, Jie; Xiong, Yu; Wu, Yuen; Gong, Yue; Yao, Tao; Liu, Wei; Zheng, Lirong; Dong, Juncai; Wang, Yu; Zhuang, Zhongbin; Xing, Wei; He, Chun-Ting; Peng, Chao; Cheong, Weng-Chon; Li, Qiheng; Zhang, Maolin; Chen, Zheng; Fu, Ninghua; Gao, Xin; Zhu, Wei; Wan, Jiawei; Zhang, Jian; Gu, Lin; Wei, Shiqiang; Hu, Peijun; Luo, Jun; Li, Jun; Chen, Chen; Peng, Qing; Duan, Xiangfeng; Huang, Yu; Chen, Xiao-Ming; Wang, Dingsheng; Li, Yadong","Iridium single-atom catalyst on nitrogen-doped carbon for formic acid oxidation synthesized using a general host–guest strategy","Nature Chemistry","","1755-4349","10.1038/s41557-020-0473-9","https://www.nature.com/articles/s41557-020-0473-9","Single-atom catalysts not only maximize metal atom efficiency, they also display properties that are considerably different to their more conventional nanoparticle equivalents, making them a promising family of materials to investigate. Herein we developed a general host–guest strategy to fabricate various metal single-atom catalysts on nitrogen-doped carbon (M1/CN, M = Pt, Ir, Pd, Ru, Mo, Ga, Cu, Ni, Mn). The iridium variant Ir1/CN electrocatalyses the formic acid oxidation reaction with a mass activity of 12.9 $${{{\rm{A}}\,{\rm{mg}}^{-1}_{{\rm{Ir}}}}}$$ whereas an Ir/C nanoparticle catalyst is almost inert (~4.8 × 10−3 $${{{\rm{A}}\,{\rm{mg}}^{-1}_{{\rm{Ir}}}}}$$). The activity of Ir1/CN is also 16 and 19 times greater than those of Pd/C and Pt/C, respectively. Furthermore, Ir1/CN displays high tolerance to CO poisoning. First-principle density functional theory reveals that the properties of Ir1/CN stem from the spatial isolation of iridium sites and from the modified electronic structure of iridium with respect to a conventional nanoparticle catalyst.","2020-08","2025-05-09 07:30:33","2025-05-09 07:30:33","2025-05-09 07:30:33","764-772","","8","12","","Nat. Chem.","","","","","","","","en","2020 The Author(s), under exclusive licence to Springer Nature Limited","","","","www.nature.com","","Publisher: Nature Publishing Group","","D:\Zotero-data\storage\ZGHSB7BF\Li et al. - 2020 - Iridium single-atom catalyst on nitrogen-doped carbon for formic acid oxidation synthesized using a.pdf","","","Electrocatalysis; Materials chemistry","","","","","","","","","","","","","","","","","","","","","","","","","","","","","","","","","","","","","","","","","","","","","",""
"TK3NB44G","journalArticle","2020","Sun, Xi; Dawson, Simon R.; Parmentier, Tanja E.; Malta, Grazia; Davies, Thomas E.; He, Qian; Lu, Li; Morgan, David J.; Carthey, Nicholas; Johnston, Peter; Kondrat, Simon A.; Freakley, Simon J.; Kiely, Christopher J.; Hutchings, Graham J.","Facile synthesis of precious-metal single-site catalysts using organic solvents","Nature Chemistry","","1755-4349","10.1038/s41557-020-0446-z","https://www.nature.com/articles/s41557-020-0446-z","Single-site catalysts can demonstrate high activity and selectivity in many catalytic reactions. The synthesis of these materials by impregnation from strongly oxidizing aqueous solutions or pH-controlled deposition often leads to low metal loadings or a range of metal species. Here, we demonstrate that simple impregnation of the metal precursors onto activated carbon from a low-boiling-point, low-polarity solvent, such as acetone, results in catalysts with an atomic dispersion of cationic metal species. We show the generality of this method by producing single-site Au, Pd, Ru and Pt catalysts supported on carbon in a facile manner. Single-site Au/C catalysts have previously been validated commercially to produce vinyl chloride, and here we show that this facile synthesis method can produce effective catalysts for acetylene hydrochlorination in the absence of the highly oxidizing acidic solvents previously used.","2020-06","2025-05-09 07:30:12","2025-05-09 07:30:12","2025-05-09 07:30:12","560-567","","6","12","","Nat. Chem.","","","","","","","","en","2020 The Author(s), under exclusive licence to Springer Nature Limited","","","","www.nature.com","","Publisher: Nature Publishing Group","","D:\Zotero-data\storage\I57LYSPM\Sun et al. - 2020 - Facile synthesis of precious-metal single-site catalysts using organic solvents.pdf","","","Green chemistry; Catalysis","","","","","","","","","","","","","","","","","","","","","","","","","","","","","","","","","","","","","","","","","","","","","",""
"9EAD9XA9","journalArticle","2022","Yan, George; Tang, Yu; Li, Yuting; Li, Yixiao; Nguyen, Luan; Sakata, Tomohiro; Higashi, Kotaro; Tao, Franklin Feng; Sautet, Philippe","Reaction product-driven restructuring and assisted stabilization of a highly dispersed Rh-on-ceria catalyst","Nature Catalysis","","2520-1158","10.1038/s41929-022-00741-2","https://www.nature.com/articles/s41929-022-00741-2","Understanding the structural dynamics of a catalyst under reaction conditions is challenging but crucial regarding catalyst design. Here, by a combination of in situ/operando characterization and first-principles modelling, we show that supported rhodium (Rh) catalysts undergo restructuring at the atomic scale in response to carbon monoxide (CO), a gaseous product formed during steam reforming of methane. Despite transformation of the initially prepared single-Rh-cation catalyst into Rh nanoparticles during hydrogen pretreatment, the formed Rh nanoparticles redispersed to low-nuclearity, CO-liganded Rh clusters (Rhm(CO)n (m = 1–3, n = 2–4)) under catalytic conditions. Theoretical simulations under reaction conditions suggest that the pressure of the CO product stabilizes Rhm(CO)n sites, while in situ/operando spectroscopy revealed a reversible restructuring between Rh3(CO)3 clusters and CO-ligand-free Rh clusters driven by CO pressure. Our findings demonstrate the importance of including product molecules in the atomic-scale understanding of catalytic active sites and mechanisms.","2022-02","2025-05-09 07:29:35","2025-05-09 07:29:35","2025-05-09 07:29:35","119-127","","2","5","","Nat Catal","","","","","","","","en","2022 The Author(s), under exclusive licence to Springer Nature Limited","","","","www.nature.com","","Publisher: Nature Publishing Group","","D:\Zotero-data\storage\937W6L7A\Yan et al. - 2022 - Reaction product-driven restructuring and assisted stabilization of a highly dispersed Rh-on-ceria c.pdf","","","Heterogeneous catalysis; Structure prediction","","","","","","","","","","","","","","","","","","","","","","","","","","","","","","","","","","","","","","","","","","","","","",""
"HEQRNAQ3","journalArticle","2020","Xie, Xiaohong; He, Cheng; Li, Boyang; He, Yanghua; Cullen, David A.; Wegener, Evan C.; Kropf, A. Jeremy; Martinez, Ulises; Cheng, Yingwen; Engelhard, Mark H.; Bowden, Mark E.; Song, Miao; Lemmon, Teresa; Li, Xiaohong S.; Nie, Zimin; Liu, Jian; Myers, Deborah J.; Zelenay, Piotr; Wang, Guofeng; Wu, Gang; Ramani, Vijay; Shao, Yuyan","Performance enhancement and degradation mechanism identification of a single-atom Co–N–C catalyst for proton exchange membrane fuel cells","Nature Catalysis","","2520-1158","10.1038/s41929-020-00546-1","https://www.nature.com/articles/s41929-020-00546-1","The development of catalysts free of platinum-group metals and with both a high activity and durability for the oxygen reduction reaction in proton exchange membrane fuel cells is a grand challenge. Here we report an atomically dispersed Co and N co-doped carbon (Co–N–C) catalyst with a high catalytic oxygen reduction reaction activity comparable to that of a similarly synthesized Fe–N–C catalyst but with a four-time enhanced durability. The Co–N–C catalyst achieved a current density of 0.022 A cm−2 at 0.9 ViR-free (internal resistance-compensated voltage) and peak power density of 0.64 W cm−2 in 1.0 bar H2/O2 fuel cells, higher than that of non-iron platinum-group-metal-free catalysts reported in the literature. Importantly, we identified two main degradation mechanisms for metal (M)–N–C catalysts: catalyst oxidation by radicals and active-site demetallation. The enhanced durability of Co–N–C relative to Fe–N–C is attributed to the lower activity of Co ions for Fenton reactions that produce radicals from the main oxygen reduction reaction by-product, H2O2, and the significantly enhanced resistance to demetallation of Co–N–C.","2020-12","2025-05-09 07:27:49","2025-05-09 07:27:49","2025-05-09 07:27:49","1044-1054","","12","3","","Nat Catal","","","","","","","","en","2020 This is a U.S. government work and not under copyright protection in the U.S.; foreign copyright protection may apply","","","","www.nature.com","","Publisher: Nature Publishing Group","","D:\Zotero-data\storage\4USUE5FM\Xie et al. - 2020 - Performance enhancement and degradation mechanism identification of a single-atom Co–N–C catalyst fo.pdf","","","Heterogeneous catalysis; Energy; Electrocatalysis; Fuel cells","","","","","","","","","","","","","","","","","","","","","","","","","","","","","","","","","","","","","","","","","","","","","",""
"67IEATB5","journalArticle","2021","Li, Meng; Hua, Bin; Wang, Lu-Cun; Sugar, Joshua D.; Wu, Wei; Ding, Yong; Li, Ju; Ding, Dong","Switching of metal–oxygen hybridization for selective CO2 electrohydrogenation under mild temperature and pressure","Nature Catalysis","","2520-1158","10.1038/s41929-021-00590-5","https://www.nature.com/articles/s41929-021-00590-5","Artificial carbon fixation contributes to closing the anthropogenic carbon cycle. However, large-scale conversion of CO2 into selective products remains a challenge. Coupled thermal–electrochemical catalysis could offer an attractive approach to upgrading CO2 into value-added products if selective electrocatalysts and integrated devices were developed. Here we identify a mechanistic route to selectively producing either CO or CH4 with high selectivity (>95%) using Ir–ceria-based catalysts in an intermediate-temperature (400 °C) CO2 electrolyser that operates at low overpotential and ambient pressure. We show that tuning of the Ir–O hybridization by controlling the Ir speciation can alter the catalyst surface chemical environment, enabling the stabilization of specific transition states for the production of either CO or CH4 during electrocatalysis. By achieving CO2 electrohydrogenation in tandem with light-alkane electrodehydrogenation, we further demonstrate that such an advanced electrolyser could be extended to the upgrade of different carbon resources in one-step, significantly enhancing the techno-economic feasibilty of the process.","2021-04","2025-05-09 07:26:18","2025-05-09 07:26:18","2025-05-09 07:26:18","274-283","","4","4","","Nat Catal","","","","","","","","en","2021 The Author(s), under exclusive licence to Springer Nature Limited","","","","www.nature.com","","Publisher: Nature Publishing Group","","D:\Zotero-data\storage\M6Z66YXT\Li et al. - 2021 - Switching of metal–oxygen hybridization for selective CO2 electrohydrogenation under mild temperatur.pdf","","","Heterogeneous catalysis; Energy; Electrocatalysis; Chemical engineering","","","","","","","","","","","","","","","","","","","","","","","","","","","","","","","","","","","","","","","","","","","","","",""
"PNSJED9S","journalArticle","2021","Zhang, Chunyang; Liang, Suxia; Liu, Wei; Eickemeyer, Felix T.; Cai, Xiangbin; Zhou, Ke; Bian, Jiming; Zhu, Hongwei; Zhu, Chao; Wang, Ning; Wang, Zaiwei; Zhang, Jiangwei; Wang, Yudi; Hu, Jinwen; Ma, Hongru; Xin, Cuncun; Zakeeruddin, Shaik Mohammed; Grätzel, Michael; Shi, Yantao","Ti1–graphene single-atom material for improved energy level alignment in perovskite solar cells","Nature Energy","","2058-7546","10.1038/s41560-021-00944-0","https://www.nature.com/articles/s41560-021-00944-0","Carbon-based perovskite solar cells (C-PSCs) are widely accepted as stable, cost-effective photovoltaics. However, C-PSCs have been suffering from relatively low power conversion efficiencies (PCEs) due to severe electrode-related energy loss. Herein, we report the application of a single-atom material (SAM) as the back electrode in C-PSCs. Our Ti1–rGO consists of single titanium (Ti) adatoms anchored on reduced graphene oxide (rGO) in a well-defined Ti1O4-OH configuration capable of tuning the electronic properties of rGO. The downshift of the Fermi level notably minimizes the series resistance of the carbon-based electrode. By combining with an advanced modular cell architecture, a steady-state PCE of up to 20.6% for C-PSCs is finally achieved. Furthermore, the devices without encapsulation retain 98% and 95% of their initial values for 1,300 h under 1 sun of illumination at 25°C and 60 °C, respectively.","2021-12","2025-05-09 06:41:28","2025-05-09 06:41:28","2025-05-09 06:41:28","1154-1163","","12","6","","Nat Energy","","","","","","","","en","2021 The Author(s), under exclusive licence to Springer Nature Limited","","","","www.nature.com","","Publisher: Nature Publishing Group","","D:\Zotero-data\storage\XTDUSZWB\Zhang et al. - 2021 - Ti1–graphene single-atom material for improved energy level alignment in perovskite solar cells.pdf","","","Energy; Nanoscale materials; Materials for devices; Solar cells","","","","","","","","","","","","","","","","","","","","","","","","","","","","","","","","","","","","","","","","","","","","","",""
"FJXXYW4D","journalArticle","2019","Cao, Linlin; Luo, Qiquan; Liu, Wei; Lin, Yue; Liu, Xiaokang; Cao, Yuanjie; Zhang, Wei; Wu, Yuen; Yang, Jinlong; Yao, Tao; Wei, Shiqiang","Identification of single-atom active sites in carbon-based cobalt catalysts during electrocatalytic hydrogen evolution","Nature Catalysis","","2520-1158","10.1038/s41929-018-0203-5","https://www.nature.com/articles/s41929-018-0203-5","Monitoring atomic and electronic structure changes on active sites under realistic working conditions is crucial for the rational design of efficient electrocatalysts. Identification of the active structure during the alkaline hydrogen evolution reaction (HER), which is critical to industrial water–alkali electrolysers, remains elusive and is a field of intense research. Here, by virtue of operando X-ray absorption spectroscopy on a uniform cobalt single-site catalyst, we report the atomic-level identification of the dynamic structure of catalytically active sites under alkaline HER. Our results reveal the formation of a high-valence HO–Co1–N2 moiety by the binding between isolated Co1–N4 sites with electrolyte hydroxide, and further unravel the preferred water adsorption reaction intermediate H2O–(HO–Co1–N2). Theoretical simulations rationalize this structural evolution and demonstrate that the highly oxidized Co sites are responsible for the catalytic performance. These findings suggest the electrochemical susceptibility of active sites, providing a coordination-engineered strategy for the advance of single-site catalysis.","2019-02","2025-05-09 06:36:20","2025-05-09 06:36:20","2025-05-09 06:36:20","134-141","","2","2","","Nat Catal","","","","","","","","en","2018 The Author(s), under exclusive licence to Springer Nature Limited","","","","www.nature.com","","Publisher: Nature Publishing Group","","D:\Zotero-data\storage\LPNHKWYA\Cao et al. - 2019 - Identification of single-atom active sites in carbon-based cobalt catalysts during electrocatalytic.pdf","","","Heterogeneous catalysis; Energy; Electrocatalysis","","","","","","","","","","","","","","","","","","","","","","","","","","","","","","","","","","","","","","","","","","","","","",""
"VCRQ8JSL","journalArticle","2025","Liu, Jiyuan; Li, Pengsong; Jia, Shuaiqiang; Wang, Yong; Jing, Lihong; Liu, Zhimin; Zhang, Jianling; Qian, Qingli; Kang, Xinchen; Sun, Xiaofu; Zhu, Qinggong; Han, Buxing","Electrocatalytic CO2 hydrogenation to C2+ alcohols catalysed by Pr–Cu oxide heterointerfaces","Nature Synthesis","","2731-0582","10.1038/s44160-025-00752-4","https://www.nature.com/articles/s44160-025-00752-4","Efficient production of C2+ alcohols from the electrochemical CO2 reduction reaction (CO2RR) is of great interest. However, the CO2RR to C2+ alcohols has low selectivity and current density due to competing C2+ pathways that produce ethylene (C2H4). Here we report a stepwise precipitation and stepwise calcination strategy to create Pr–Cu oxide heterointerfaces (Pr6O11–Cu-SS) that produces an efficient CO2RR to C2+ alcohols. Pr6O11–Cu-SS exhibited high productivity and Faradaic efficiency (FE) for C2+ alcohols. At −1.08 V versus RHE, the current density and FE of C2+ alcohols reached 700 mA cm−2 and 71.3%, respectively, with the FEs of ethanol and n-propanol reaching 58.6% and 12.7%, respectively, under these conditions. The C2+ alcohols/C2H4 ratio was as high as 12:1. Experimental and theoretical studies indicated that the performance of the catalyst results from the existence of a Pr4+/Pr3+ structure in Pr6O11–Cu-SS, which is able to effectively stabilize Cuδ+/Cu0 via a unique Pr–O–Cu linkage and form stable oxide heterointerfaces. The binding strength and binding type of *CO were then altered on the heterointerfaces to form a mixed adsorption configuration, which induces asymmetric carbon–carbon coupling and selective hydrodeoxygenation to promote the generation of C2+ alcohols.","2025-03-13","2025-05-09 06:35:06","2025-05-09 06:35:06","2025-05-09 06:35:06","1-14","","","","","Nat. Synth","","","","","","","","en","2025 The Author(s), under exclusive licence to Springer Nature Limited","","","","www.nature.com","","Publisher: Nature Publishing Group","","D:\Zotero-data\storage\L7ZV862F\Liu et al. - 2025 - Electrocatalytic CO2 hydrogenation to C2+ alcohols catalysed by Pr–Cu oxide heterointerfaces.pdf","","","Electrocatalysis","","","","","","","","","","","","","","","","","","","","","","","","","","","","","","","","","","","","","","","","","","","","","",""
