"LVD5GULF","journalArticle","2021","Li, Zhe; Xiao, Yang; Chowdhury, Prabudhya Roy; Wu, Zhenwei; Ma, Tao; Chen, Johnny Zhu; Wan, Gang; Kim, Tae-Hoon; Jing, Dapeng; He, Peilei; Potdar, Pratik J.; Zhou, Lin; Zeng, Zhenhua; Ruan, Xiulin; Miller, Jeffrey T.; Greeley, Jeffrey P.; Wu, Yue; Varma, Arvind","Direct methane activation by atomically thin platinum nanolayers on two-dimensional metal carbides","Nature Catalysis","","2520-1158","10.1038/s41929-021-00686-y","https://www.nature.com/articles/s41929-021-00686-y","Efficient and direct conversion of methane to value-added products has been a long-term challenge in shale gas applications. Here, we show that atomically thin nanolayers of Pt with a single or double atomic layer thickness, supported on a two-dimensional molybdenum titanium carbide (MXene), catalyse non-oxidative coupling of methane to ethane/ethylene (C2). Kinetic and theoretical studies, combined with in-situ spectroscopic and microscopic characterizations, demonstrate that Pt nanolayers anchored at the hexagonal close-packed sites of the MXene support can activate the first C–H bond of methane to form methyl radicals that favour desorption over further dehydrogenation and thus suppress coke deposition. At 750 °C and 7% methane conversion, the catalyst runs for 72 hours of continuous operation without deactivation and exhibits >98% selectivity towards C2 products, with a turnover frequency of 0.2–0.6 s−1. Our findings provide insights into the design of highly active and stable catalysts for methane activation and create a platform for developing atomically thin supported metal catalysts.","2021-10","2025-05-09 06:25:39","2025-05-09 06:25:39","2025-05-09 06:25:39","882-891","","10","4","","Nat Catal","","","","","","","","en","2021 The Author(s), under exclusive licence to Springer Nature Limited","","","","www.nature.com","","Publisher: Nature Publishing Group","","D:\Zotero-data\storage\GSA4JNPX\Li et al. - 2021 - Direct methane activation by atomically thin platinum nanolayers on two-dimensional metal carbides.pdf","","","Catalytic mechanisms; Heterogeneous catalysis; Chemical engineering; Two-dimensional materials","","","","","","","","","","","","","","","","","","","","","","","","","","","","","","","","","","","","","","","","","","","","","",""
"NB4PSULW","journalArticle","2022","Zhao, Huibo; Yu, Ruofan; Ma, Sicong; Xu, Kaizhuang; Chen, Yang; Jiang, Kun; Fang, Yuan; Zhu, Caixia; Liu, Xiaochen; Tang, Yu; Wu, Lizhi; Wu, Yingquan; Jiang, Qike; He, Peng; Liu, Zhipan; Tan, Li","The role of Cu1–O3 species in single-atom Cu/ZrO2 catalyst for CO2 hydrogenation","Nature Catalysis","","2520-1158","10.1038/s41929-022-00840-0","https://www.nature.com/articles/s41929-022-00840-0","Copper-based catalysts for the hydrogenation of CO2 to methanol have attracted much interest. The complex nature of these catalysts, however, renders the elucidation of their structure–activity properties difficult. Here we report a copper-based catalyst with isolated active copper sites for the hydrogenation of CO2 to methanol. It is revealed that the single-atom Cu–Zr catalyst with Cu1–O3 units contributes solely to methanol synthesis around 180 °C, while the presence of small copper clusters or nanoparticles with Cu–Cu structural patterns are responsible for forming the CO by-product. Furthermore, the gradual migration of Cu1–O3 units with a quasiplanar structure to the catalyst surface is observed during the catalytic process and accelerates CO2 hydrogenation. The highly active, isolated copper sites and the distinguishable structural pattern identified here extend the horizon of single-atom catalysts for applications in thermal catalytic CO2 hydrogenation and could guide the further design of high-performance copper-based catalysts to meet industrial demand.","2022-09","2025-05-09 06:22:34","2025-05-09 06:22:34","2025-05-09 06:22:34","818-831","","9","5","","Nat Catal","","","","","","","","en","2022 The Author(s), under exclusive licence to Springer Nature Limited","","","","www.nature.com","","Publisher: Nature Publishing Group","","D:\Zotero-data\storage\H58VC82U\Zhao et al. - 2022 - The role of Cu1–O3 species in single-atom CuZrO2 catalyst for CO2 hydrogenation.pdf","","","Catalytic mechanisms; Heterogeneous catalysis","","","","","","","","","","","","","","","","","","","","","","","","","","","","","","","","","","","","","","","","","","","","","",""
"DR3QHXV4","journalArticle","2022","Dong, Chunyang; Gao, Zirui; Li, Yinlong; Peng, Mi; Wang, Meng; Xu, Yao; Li, Chengyu; Xu, Ming; Deng, Yuchen; Qin, Xuetao; Huang, Fei; Wei, Xuyan; Wang, Yang-Gang; Liu, Hongyang; Zhou, Wu; Ma, Ding","Fully exposed palladium cluster catalysts enable hydrogen production from nitrogen heterocycles","Nature Catalysis","","2520-1158","10.1038/s41929-022-00769-4","https://www.nature.com/articles/s41929-022-00769-4","The size of supported metal species is known to have a profound influence on their catalytic activity. However, this structure sensitivity remains ambiguous for metals at the atomic scale due to the lack of single-atom sensitive and statistically significant quantification methods. Here we overcome this difficulty to quantify the catalytic contribution of various surface palladium species, ranging from single atoms to sub-nanometre clusters and nanoparticles, in the dehydrogenation of dodecahydro-N-ethylcarbazole, a reaction of importance for H2 transportation and utilization. We show that the optimal site is a fully exposed palladium cluster with an average Pd–Pd coordination number of ∼4.4, favouring both the activation of reactants and desorption of products, whereas palladium single atoms are almost inactive. Our study highlights that for certain catalytic reactions, the construction of fully exposed metal clusters without the presence of spectators (that is, palladium single atoms in this work) could help to maximize the reactivity and the atomic efficiency of noble metals.","2022-06","2025-05-09 06:20:56","2025-05-09 06:20:56","2025-05-09 06:20:56","485-493","","6","5","","Nat Catal","","","","","","","","en","2022 The Author(s), under exclusive licence to Springer Nature Limited","","","","www.nature.com","","Publisher: Nature Publishing Group","","D:\Zotero-data\storage\VLWWYUGA\Dong et al. - 2022 - Fully exposed palladium cluster catalysts enable hydrogen production from nitrogen heterocycles.pdf","","","Catalytic mechanisms; Heterogeneous catalysis; Surface assembly; Chemical hydrogen storage","","","","","","","","","","","","","","","","","","","","","","","","","","","","","","","","","","","","","","","","","","","","","",""
"EVBY86KL","journalArticle","2023","Ma, Yue; Song, Shaojia; Liu, Changcheng; Liu, Lingmei; Zhang, Longkang; Zhao, Yuhong; Wang, Xin; Xu, Hao; Guan, Yejun; Jiang, Jingang; Song, Weiyu; Han, Yu; Zhang, Jiangwei; Wu, Peng","Germanium-enriched double-four-membered-ring units inducing zeolite-confined subnanometric Pt clusters for efficient propane dehydrogenation","Nature Catalysis","","2520-1158","10.1038/s41929-023-00968-7","https://www.nature.com/articles/s41929-023-00968-7","It is a great challenge to regulate the precise placement of confined metal species and assemble specific structures at the atomic level. Here we report the design and synthesis of a durable supported-metal-cluster catalyst, Pt@Ge-UTL, that features subnanometric Pt clusters encapsulated inside the extra-large pores of a stabilized UTL-type germanosilicate. Integrated differential phase contrast scanning transmission electron microscopy, in situ X-ray absorption fine structure, 19F magic-angle-spinning NMR, full-range synchrotron pair distribution function G(r) analysis and density functional theory calculations revealed that Pt clusters with an average of four atoms are firmly segregated within 14-membered-ring channels. This is achieved by selectively and directionally anchoring Pt, via Pt–O–Ge bonding, to the UTL zeolite’s unique secondary building units that feature a double-four-membered-ring (d4r) configuration and a Ge-enriched composition. The host–guest bimetallic structure (Pt4-Ge2-d4r@UTL) promotes propane dehydrogenation with high activity, high propylene selectivity and long-term stability. This research demonstrates the use of germanosilicates in the designed synthesis of high-performance propane dehydrogenation catalysts.","2023-06","2025-05-09 06:17:57","2025-05-09 06:17:57","2025-05-09 06:17:57","506-518","","6","6","","Nat Catal","","","","","","","","en","2023 The Author(s), under exclusive licence to Springer Nature Limited","","","","www.nature.com","","Publisher: Nature Publishing Group","","D:\Zotero-data\storage\KGZH84F2\Ma et al. - 2023 - Germanium-enriched double-four-membered-ring units inducing zeolite-confined subnanometric Pt cluste.pdf","","","Heterogeneous catalysis; Nanoparticles; Reaction kinetics and dynamics","","","","","","","","","","","","","","","","","","","","","","","","","","","","","","","","","","","","","","","","","","","","","",""
"286BC244","journalArticle","2024","Brückner, Sven; Feng, Quanchen; Ju, Wen; Galliani, Daniela; Testolin, Anna; Klingenhof, Malte; Ott, Sebastian; Strasser, Peter","Design and diagnosis of high-performance CO2-to-CO electrolyzer cells","Nature Chemical Engineering","","2948-1198","10.1038/s44286-024-00035-3","https://www.nature.com/articles/s44286-024-00035-3","This work reports the design and diagnostic analysis of a pH-neutral CO2-to-CO zero-gap electrolyzer cell incorporating a nickel–nitrogen-doped carbon catalyst. The cell yields ~100% CO faradaic efficiency at applied current densities of up to 250 mA cm−2 at low cell voltage and 40% total energy efficiency. It features a low stoichiometric CO2 excess, λstoich, of 1.2 that yields a molar CO concentration of ~70%vol in the electrolyzer exit stream at 40% single-pass CO2 conversion, with over 100 h stability. Here we introduce the experimental carbon crossover coefficient (CCC) as a tool for electrolyzer cell diagnostics. The CCC describes the ratio between noncatalytic acid–base CO2 consumption and catalytically generated alkalinity, thereby offering insight into the nature of the prevalent ionic transport and transport mechanisms of undesired CO2 losses. We demonstrate the diagnostic value of the CCC in transport-based cell failure during oscillatory cell flooding between salt precipitation and salt redissolution. The present dynamic cell diagnostics provide practical guidelines toward improved CO2 electrolyzer designs.","2024-03","2025-05-09 06:14:05","2025-05-09 06:14:05","2025-05-09 06:14:05","229-239","","3","1","","Nat Chem Eng","","","","","","","","en","2024 The Author(s), under exclusive licence to Springer Nature America, Inc.","","","","www.nature.com","","Publisher: Nature Publishing Group","","D:\Zotero-data\storage\TNBMMPF6\Brückner et al. - 2024 - Design and diagnosis of high-performance CO2-to-CO electrolyzer cells.pdf","","","Porous materials; Carbon capture and storage; Electrocatalysis; Chemical engineering; Sustainability","","","","","","","","","","","","","","","","","","","","","","","","","","","","","","","","","","","","","","","","","","","","","",""
"P5TNAJQA","journalArticle","2023","Sun, Tao; Tang, Zhiyuan; Zang, Wenjie; Li, Zejun; Li, Jing; Li, Zhihao; Cao, Liang; Dominic Rodriguez, Jan Sebastian; Mariano, Carl Osby M.; Xu, Haomin; Lyu, Pin; Hai, Xiao; Lin, Huihui; Sheng, Xiaoyu; Shi, Jiwei; Zheng, Yi; Lu, Ying-Rui; He, Qian; Chen, Jingsheng; Novoselov, Kostya S.; Chuang, Cheng-Hao; Xi, Shibo; Luo, Xin; Lu, Jiong","Ferromagnetic single-atom spin catalyst for boosting water splitting","Nature Nanotechnology","","1748-3395","10.1038/s41565-023-01407-1","https://www.nature.com/articles/s41565-023-01407-1","Heterogeneous single-atom spin catalysts combined with magnetic fields provide a powerful means for accelerating chemical reactions with enhanced metal utilization and reaction efficiency. However, designing these catalysts remains challenging due to the need for a high density of atomically dispersed active sites with a short-range quantum spin exchange interaction and long-range ferromagnetic ordering. Here, we devised a scalable hydrothermal approach involving an operando acidic environment for synthesizing various single-atom spin catalysts with widely tunable substitutional magnetic atoms (M1) in a MoS2 host. Among all the M1/MoS2 species, Ni1/MoS2 adopts a distorted tetragonal structure that prompts both ferromagnetic coupling to nearby S atoms as well as adjacent Ni1 sites, resulting in global room-temperature ferromagnetism. Such coupling benefits spin-selective charge transfer in oxygen evolution reactions to produce triplet O2. Furthermore, a mild magnetic field of ~0.5 T enhances the oxygen evolution reaction magnetocurrent by ~2,880% over Ni1/MoS2, leading to excellent activity and stability in both seawater and pure water splitting cells. As supported by operando characterizations and theoretical calculations, a great magnetic-field-enhanced oxygen evolution reaction performance over Ni1/MoS2 is attributed to a field-induced spin alignment and spin density optimization over S active sites arising from field-regulated S(p)–Ni(d) hybridization, which in turn optimizes the adsorption energies for radical intermediates to reduce overall reaction barriers.","2023-07","2025-05-09 06:13:07","2025-05-09 06:13:07","2025-05-09 06:13:07","763-771","","7","18","","Nat. Nanotechnol.","","","","","","","","en","2023 The Author(s), under exclusive licence to Springer Nature Limited","","","","www.nature.com","","Publisher: Nature Publishing Group","","D:\Zotero-data\storage\U7H3V6DH\Sun et al. - 2023 - Ferromagnetic single-atom spin catalyst for boosting water splitting.pdf","","","Electrocatalysis","","","","","","","","","","","","","","","","","","","","","","","","","","","","","","","","","","","","","","","","","","","","","",""
"RVIXVUJT","journalArticle","2022","Parastaev, Alexander; Muravev, Valery; Osta, Elisabet Huertas; Kimpel, Tobias F.; Simons, Jérôme F. M.; van Hoof, Arno J. F.; Uslamin, Evgeny; Zhang, Long; Struijs, Job J. C.; Burueva, Dudari B.; Pokochueva, Ekaterina V.; Kovtunov, Kirill V.; Koptyug, Igor V.; Villar-Garcia, Ignacio J.; Escudero, Carlos; Altantzis, Thomas; Liu, Pei; Béché, Armand; Bals, Sara; Kosinov, Nikolay; Hensen, Emiel J. M.","Breaking structure sensitivity in CO2 hydrogenation by tuning metal–oxide interfaces in supported cobalt nanoparticles","Nature Catalysis","","2520-1158","10.1038/s41929-022-00874-4","https://www.nature.com/articles/s41929-022-00874-4","A high dispersion of the active metal phase of transition metals on oxide supports is important when designing efficient heterogeneous catalysts. Besides nanoparticles, clusters and even single metal atoms can be attractive for a wide range of reactions. However, many industrially relevant catalytic transformations suffer from structure sensitivity, where reducing the size of the metal particles below a certain size substantially lowers catalytic performance. A case in point is the low activity of small cobalt nanoparticles in the hydrogenation of CO and CO2. Here we show how engineering of catalytic sites at the metal–oxide interface in cerium oxide–zirconium dioxide (ceria–zirconia)-supported cobalt can overcome this structure sensitivity. Few-atom cobalt clusters dispersed on 3 nm cobalt(II)-oxide particles stabilized by ceria–zirconia yielded a highly active CO2 methanation catalyst with a specific activity higher than that of larger particles under the same conditions.","2022-11","2025-05-09 06:10:36","2025-05-09 06:10:36","2025-05-09 06:10:36","1051-1060","","11","5","","Nat Catal","","","","","","","","en","2022 The Author(s), under exclusive licence to Springer Nature Limited","","","","www.nature.com","","Publisher: Nature Publishing Group","","D:\Zotero-data\storage\SSQNBL2G\Parastaev et al. - 2022 - Breaking structure sensitivity in CO2 hydrogenation by tuning metal–oxide interfaces in supported co.pdf","","","Catalytic mechanisms; Heterogeneous catalysis; Nanoparticles","","","","","","","","","","","","","","","","","","","","","","","","","","","","","","","","","","","","","","","","","","","","","",""
"K886W84R","journalArticle","2023","Wang, Sikai; Fung, Victor; Hülsey, Max J.; Liang, Xiaocong; Yu, Zhiyang; Chang, Jinquan; Folli, Andrea; Lewis, Richard J.; Hutchings, Graham J.; He, Qian; Yan, Ning","H2-reduced phosphomolybdate promotes room-temperature aerobic oxidation of methane to methanol","Nature Catalysis","","2520-1158","10.1038/s41929-023-01011-5","https://www.nature.com/articles/s41929-023-01011-5","The selective partial oxidation of methane to methanol using molecular oxygen (O2) represents a long-standing challenge, inspiring extensive study for many decades. However, considerable challenges still prevent low-temperature methane activation via the aerobic route. Here we report a precipitated Pd-containing phosphomolybdate, which, after activation by molecular hydrogen (H2), converts methane and O2 almost exclusively to methanol at room temperature. The highest activity reaches 67.4 μmol gcat−1 h−1. Pd enables rapid H2 activation and H spillover to phosphomolybdate for Mo reduction, while facile O2 activation and subsequent methane activation occur on the reduced phosphomolybdate sites. Continuous production of methanol from methane was also achieved by concurrently introducing H2, O2 and methane into the system, where H2 assists in maintaining a moderately reduced state of phosphomolybdate. This work reveals the underexplored potential of such a Mo-based catalyst for aerobic methane oxidation and highlights the importance of regulating the chemical valence state to construct methane active sites.","2023-10","2025-05-09 06:05:37","2025-05-09 06:05:37","2025-05-09 06:05:37","895-905","","10","6","","Nat Catal","","","","","","","","en","2023 The Author(s), under exclusive licence to Springer Nature Limited","","","","www.nature.com","","Publisher: Nature Publishing Group","","D:\Zotero-data\storage\84MU325A\Wang et al. - 2023 - H2-reduced phosphomolybdate promotes room-temperature aerobic oxidation of methane to methanol.pdf","","","Catalytic mechanisms; Heterogeneous catalysis","","","","","","","","","","","","","","","","","","","","","","","","","","","","","","","","","","","","","","","","","","","","","",""
"2FZ7K8IZ","journalArticle","2019","Yao, Yonggang; Huang, Zhennan; Xie, Pengfei; Wu, Lianping; Ma, Lu; Li, Tangyuan; Pang, Zhenqian; Jiao, Miaolun; Liang, Zhiqiang; Gao, Jinlong; He, Yang; Kline, Dylan Jacob; Zachariah, Michael R.; Wang, Chongmin; Lu, Jun; Wu, Tianpin; Li, Teng; Wang, Chao; Shahbazian-Yassar, Reza; Hu, Liangbing","High temperature shockwave stabilized single atoms","Nature Nanotechnology","","1748-3395","10.1038/s41565-019-0518-7","https://www.nature.com/articles/s41565-019-0518-7","The stability of single-atom catalysts is critical for their practical applications. Although a high temperature can promote the bond formation between metal atoms and the substrate with an enhanced stability, it often causes atom agglomeration and is incompatible with many temperature-sensitive substrates. Here, we report using controllable high-temperature shockwaves to synthesize and stabilize single atoms at very high temperatures (1,500–2,000 K), achieved by a periodic on–off heating that features a short on state (55 ms) and a ten-times longer off state. The high temperature provides the activation energy for atom dispersion by forming thermodynamically favourable metal–defect bonds and the off-state critically ensures the overall stability, especially for the substrate. The resultant high-temperature single atoms exhibit a superior thermal stability as durable catalysts. The reported shockwave method is facile, ultrafast and universal (for example, Pt, Ru and Co single atoms, and carbon, C3N4 and TiO2 substrates), which opens a general route for single-atom manufacturing that is conventionally challenging.","2019-09","2025-05-09 06:02:37","2025-05-09 06:02:37","2025-05-09 06:02:37","851-857","","9","14","","Nat. Nanotechnol.","","","","","","","","en","2019 The Author(s), under exclusive licence to Springer Nature Limited","","","","www.nature.com","","Publisher: Nature Publishing Group","","D:\Zotero-data\storage\RAZGZZ3Q\Yao et al. - 2019 - High temperature shockwave stabilized single atoms.pdf","","","Nanoparticles; Synthesis and processing","","","","","","","","","","","","","","","","","","","","","","","","","","","","","","","","","","","","","","","","","","","","","",""
"FWCZT4EZ","journalArticle","2022","Li, Xu; Pereira-Hernández, Xavier Isidro; Chen, Yizhen; Xu, Jia; Zhao, Jiankang; Pao, Chih-Wen; Fang, Chia-Yu; Zeng, Jie; Wang, Yong; Gates, Bruce C.; Liu, Jingyue","Functional CeOx nanoglues for robust atomically dispersed catalysts","Nature","","1476-4687","10.1038/s41586-022-05251-6","https://www.nature.com/articles/s41586-022-05251-6","Single-atom catalysts1 make exceptionally efficient use of expensive noble metals and can bring out unique properties1–3. However, applications are usually compromised by limited catalyst stability, which is due to sintering3,4. Although sintering can be suppressed by anchoring the metal atoms to oxide supports1,5,6, strong metal–oxygen interactions often leave too few metal sites available for reactant binding and catalysis6,7, and when exposed to reducing conditions at sufficiently high temperatures, even oxide-anchored single-atom catalysts eventually sinter4,8,9. Here we show that the beneficial effects of anchoring can be enhanced by confining the atomically dispersed metal atoms on oxide nanoclusters or ‘nanoglues’, which themselves are dispersed and immobilized on a robust, high-surface-area support. We demonstrate the strategy by grafting isolated and defective CeOx nanoglue islands onto high-surface-area SiO2; the nanoglue islands then each host on average one Pt atom. We find that the Pt atoms remain dispersed under both oxidizing and reducing environments at high temperatures, and that the activated catalyst exhibits markedly increased activity for CO oxidation. We attribute the improved stability under reducing conditions to the support structure and the much stronger affinity of Pt atoms for CeOx than for SiO2, which ensures the Pt atoms can move but remain confined to their respective nanoglue islands. The strategy of using functional nanoglues to confine atomically dispersed metals and simultaneously enhance their reactivity is general, and we anticipate that it will take single-atom catalysts a step closer to practical applications.","2022-11","2025-05-09 06:00:43","2025-05-09 06:00:43","2025-05-09 06:00:43","284-288","","7935","611","","","","","","","","","","en","2022 The Author(s), under exclusive licence to Springer Nature Limited","","","","www.nature.com","","Publisher: Nature Publishing Group","","D:\Zotero-data\storage\96V5NDKI\Li et al. - 2022 - Functional CeOx nanoglues for robust atomically dispersed catalysts.pdf","","","Heterogeneous catalysis; Chemistry","","","","","","","","","","","","","","","","","","","","","","","","","","","","","","","","","","","","","","","","","","","","","",""
"AEQ978LD","journalArticle","2025","Sun, Ruiyi; Cao, Xing; Ma, Junguo; Chen, Hsiao-Chien; Chen, Chen; Peng, Qing; Li, Yadong","Regulation of Pd single-atom coordination for enhanced photocatalytic oxidation of toluene to benzaldehyde","Nature Synthesis","","2731-0582","10.1038/s44160-025-00782-y","https://www.nature.com/articles/s44160-025-00782-y","Photocatalytic oxidation represents an effective means of hydrocarbon valorization, but achieving high-selectivity intermediate products at high substrate conversion remains challenging. Here single-atom Pd–O catalytic sites with different coordination environments are synthesized. The Pd–O3 coordinated single sites show the best catalytic performance for selective toluene oxidation, exhibiting a high benzaldehyde selectivity of 95% at 95% toluene conversion, and a benzaldehyde yield rate up to 12,000 μmol g−1 h−1, surpassing previously reported results. The Pd–O3 catalytic sites serve as the location of photogenerated charge separation and C(sp3)–H bond activation. These sites can trap the photogenerated holes effectively to enhance the charge-separation efficiency, improving the yield rate by a factor of 2.9 relative to the Bi2WO6 support. Additionally, the coordination structure weakens benzaldehyde adsorption, reducing overoxidation and improving reaction selectivity. This work highlights the importance of single-atom site coordination in optimizing the activity and selectivity of photocatalytic oxidation reactions.","2025-04-03","2025-05-09 05:03:13","2025-05-09 05:03:13","2025-05-09 05:03:13","1-11","","","","","Nat. Synth","","","","","","","","en","2025 The Author(s), under exclusive licence to Springer Nature Limited","","","","www.nature.com","","Publisher: Nature Publishing Group","","D:\Zotero-data\storage\DU84ALM9\Sun et al. - 2025 - Regulation of Pd single-atom coordination for enhanced photocatalytic oxidation of toluene to benzal.pdf","","","Photocatalysis; Synthesis and processing","","","","","","","","","","","","","","","","","","","","","","","","","","","","","","","","","","","","","","","","","","","","","",""
